tvm_compile/tuning/tx2-gpu.mobilenet-nnconv5dw-skipadd-pruned.trials=2000.stop=600.log
{"i": ["cuda", "topi_nn_conv2d", [["TENSOR", [1, 16, 224, 224], "float32"], ["TENSOR", [1, 16, 1, 1], "float32"], [1, 1], [0, 0], "NCHW", "float32"], {}, ["conv2d", [1, 16, 224, 224, "float32"], [1, 16, 1, 1, "float32"], [1, 1], [0, 0], "NCHW", "float32"], {"i": 314944, "e": [["tile_f", "sp", [1, 1, 1, 1]], ["tile_y", "sp", [224, 1, 1, 1]], ["tile_x", "sp", [1, 1, 224, 1]], ["tile_rc", "sp", [8, 2]], ["tile_ry", "sp", [1, 1]], ["tile_rx", "sp", [1, 1]], ["auto_unroll_max_step", "ot", 512], ["unroll_explicit", "ot", 0]], "t": "direct", "c": null}], "r": [[0.0001044715], 0, 1.65395188331604, 1548646492.0790715], "v": 0.1}
{"i": ["cuda", "topi_nn_conv2d", [["TENSOR", [1, 56, 112, 112], "float32"], ["TENSOR", [16, 56, 1, 1], "float32"], [1, 1], [0, 0], "NCHW", "float32"], {}, ["conv2d", [1, 56, 112, 112, "float32"], [16, 56, 1, 1, "float32"], [1, 1], [0, 0], "NCHW", "float32"], {"i": 13920913, "e": [["tile_f", "sp", [1, 2, 8, 1]], ["tile_y", "sp", [112, 1, 1, 1]], ["tile_x", "sp", [1, 4, 28, 1]], ["tile_rc", "sp", [7, 8]], ["tile_ry", "sp", [1, 1]], ["tile_rx", "sp", [1, 1]], ["auto_unroll_max_step", "ot", 1500], ["unroll_explicit", "ot", 0]], "t": "direct", "c": null}], "r": [[0.000170911], 0, 2.5805726051330566, 1548647107.7181647], "v": 0.1}
{"i": ["cuda", "topi_nn_depthwise_conv2d_nchw", [["TENSOR", [1, 56, 112, 112], "float32"], ["TENSOR", [56, 1, 5, 5], "float32"], [1, 1], [2, 2], "float32"], {}, ["depthwise_conv2d_nchw", [1, 56, 112, 112, "float32"], [56, 1, 5, 5, "float32"], [1, 1], [2, 2], "float32"], {"i": 6693600, "e": [["tile_f", "sp", [56, 1, 1, 1]], ["tile_y", "sp", [2, 1, 14, 4]], ["tile_x", "sp", [7, 1, 16, 1]], ["auto_unroll_max_step", "ot", 256], ["unroll_explicit", "ot", 1]], "t": "direct", "c": null}], "r": [[0.0002963425], 0, 2.6830427646636963, 1548648186.9543624], "v": 0.1}
{"i": ["cuda", "topi_nn_conv2d", [["TENSOR", [1, 120, 56, 56], "float32"], ["TENSOR", [56, 120, 1, 1], "float32"], [1, 1], [0, 0], "NCHW", "float32"], {}, ["conv2d", [1, 120, 56, 56, "float32"], [56, 120, 1, 1, "float32"], [1, 1], [0, 0], "NCHW", "float32"], {"i": 9907345, "e": [["tile_f", "sp", [1, 2, 4, 7]], ["tile_y", "sp", [28, 2, 1, 1]], ["tile_x", "sp", [1, 2, 28, 1]], ["tile_rc", "sp", [30, 4]], ["tile_ry", "sp", [1, 1]], ["tile_rx", "sp", [1, 1]], ["auto_unroll_max_step", "ot", 512], ["unroll_explicit", "ot", 0]], "t": "direct", "c": null}], "r": [[0.00020867025], 0, 1.3627350330352783, 1548649315.0133436], "v": 0.1}
{"i": ["cuda", "topi_nn_depthwise_conv2d_nchw", [["TENSOR", [1, 120, 56, 56], "float32"], ["TENSOR", [120, 1, 5, 5], "float32"], [1, 1], [2, 2], "float32"], {}, ["depthwise_conv2d_nchw", [1, 120, 56, 56, "float32"], [120, 1, 5, 5, "float32"], [1, 1], [2, 2], "float32"], {"i": 11456640, "e": [["tile_f", "sp", [120, 1, 1, 1]], ["tile_y", "sp", [4, 1, 7, 2]], ["tile_x", "sp", [1, 1, 28, 2]], ["auto_unroll_max_step", "ot", 1500], ["unroll_explicit", "ot", 1]], "t": "direct", "c": null}], "r": [[0.0001770705], 0, 2.9571971893310547, 1548650130.5959702], "v": 0.1}
{"i": ["cuda", "topi_nn_conv2d", [["TENSOR", [1, 256, 28, 28], "float32"], ["TENSOR", [120, 256, 1, 1], "float32"], [1, 1], [0, 0], "NCHW", "float32"], {}, ["conv2d", [1, 256, 28, 28, "float32"], [120, 256, 1, 1, "float32"], [1, 1], [0, 0], "NCHW", "float32"], {"i": 15587259, "e": [["tile_f", "sp", [5, 3, 8, 1]], ["tile_y", "sp", [4, 1, 1, 7]], ["tile_x", "sp", [1, 1, 28, 1]], ["tile_rc", "sp", [32, 8]], ["tile_ry", "sp", [1, 1]], ["tile_rx", "sp", [1, 1]], ["auto_unroll_max_step", "ot", 0], ["unroll_explicit", "ot", 1]], "t": "direct", "c": null}], "r": [[0.000176463], 0, 1.957888126373291, 1548652038.6319573], "v": 0.1}
{"i": ["cuda", "topi_nn_depthwise_conv2d_nchw", [["TENSOR", [1, 256, 28, 28], "float32"], ["TENSOR", [256, 1, 5, 5], "float32"], [1, 1], [2, 2], "float32"], {}, ["depthwise_conv2d_nchw", [1, 256, 28, 28, "float32"], [256, 1, 5, 5, "float32"], [1, 1], [2, 2], "float32"], {"i": 1495890, "e": [["tile_f", "sp", [256, 1, 1, 1]], ["tile_y", "sp", [1, 1, 14, 2]], ["tile_x", "sp", [1, 1, 14, 2]], ["auto_unroll_max_step", "ot", 1500], ["unroll_explicit", "ot", 1]], "t": "direct", "c": null}], "r": [[0.000116847], 0, 2.5286483764648438, 1548652840.9417276], "v": 0.1}
{"i": ["cuda", "topi_nn_conv2d", [["TENSOR", [1, 200, 14, 14], "float32"], ["TENSOR", [256, 200, 1, 1], "float32"], [1, 1], [0, 0], "NCHW", "float32"], {}, ["conv2d", [1, 200, 14, 14, "float32"], [256, 200, 1, 1, "float32"], [1, 1], [0, 0], "NCHW", "float32"], {"i": 697884, "e": [["tile_f", "sp", [8, 1, 8, 4]], ["tile_y", "sp", [1, 7, 2, 1]], ["tile_x", "sp", [1, 1, 14, 1]], ["tile_rc", "sp", [25, 8]], ["tile_ry", "sp", [1, 1]], ["tile_rx", "sp", [1, 1]], ["auto_unroll_max_step", "ot", 512], ["unroll_explicit", "ot", 0]], "t": "direct", "c": null}], "r": [[7.766325e-05], 0, 1.3543050289154053, 1548653774.0519202], "v": 0.1}
{"i": ["cuda", "topi_nn_depthwise_conv2d_nchw", [["TENSOR", [1, 200, 14, 14], "float32"], ["TENSOR", [200, 1, 5, 5], "float32"], [1, 1], [2, 2], "float32"], {}, ["depthwise_conv2d_nchw", [1, 200, 14, 14, "float32"], [200, 1, 5, 5, "float32"], [1, 1], [2, 2], "float32"], {"i": 273621, "e": [["tile_f", "sp", [50, 1, 4, 1]], ["tile_y", "sp", [1, 1, 14, 1]], ["tile_x", "sp", [1, 7, 2, 1]], ["auto_unroll_max_step", "ot", 1500], ["unroll_explicit", "ot", 1]], "t": "direct", "c": null}], "r": [[3.818375e-05], 0, 1.5769789218902588, 1548654909.867864], "v": 0.1}
{"i": ["cuda", "topi_nn_conv2d", [["TENSOR", [1, 512, 7, 7], "float32"], ["TENSOR", [200, 512, 1, 1], "float32"], [1, 1], [0, 0], "NCHW", "float32"], {}, ["conv2d", [1, 512, 7, 7, "float32"], [200, 512, 1, 1, "float32"], [1, 1], [0, 0], "NCHW", "float32"], {"i": 43436, "e": [["tile_f", "sp", [5, 5, 8, 1]], ["tile_y", "sp", [1, 7, 1, 1]], ["tile_x", "sp", [1, 1, 7, 1]], ["tile_rc", "sp", [64, 8]], ["tile_ry", "sp", [1, 1]], ["tile_rx", "sp", [1, 1]], ["auto_unroll_max_step", "ot", 512], ["unroll_explicit", "ot", 0]], "t": "direct", "c": null}], "r": [[9.72875e-05], 0, 2.179405450820923, 1548655486.6924798], "v": 0.1}
{"i": ["cuda", "topi_nn_depthwise_conv2d_nchw", [["TENSOR", [1, 512, 7, 7], "float32"], ["TENSOR", [512, 1, 5, 5], "float32"], [1, 1], [2, 2], "float32"], {}, ["depthwise_conv2d_nchw", [1, 512, 7, 7, "float32"], [512, 1, 5, 5, "float32"], [1, 1], [2, 2], "float32"], {"i": 19900, "e": [["tile_f", "sp", [128, 1, 1, 4]], ["tile_y", "sp", [1, 1, 7, 1]], ["tile_x", "sp", [1, 1, 7, 1]], ["auto_unroll_max_step", "ot", 1500], ["unroll_explicit", "ot", 1]], "t": "direct", "c": null}], "r": [[3.839175e-05], 0, 2.85693097114563, 1548656199.745016], "v": 0.1}
{"i": ["cuda", "topi_nn_conv2d", [["TENSOR", [1, 480, 7, 7], "float32"], ["TENSOR", [512, 480, 1, 1], "float32"], [1, 1], [0, 0], "NCHW", "float32"], {}, ["conv2d", [1, 480, 7, 7, "float32"], [512, 480, 1, 1, "float32"], [1, 1], [0, 0], "NCHW", "float32"], {"i": 287630, "e": [["tile_f", "sp", [8, 1, 32, 2]], ["tile_y", "sp", [1, 1, 1, 7]], ["tile_x", "sp", [1, 1, 7, 1]], ["tile_rc", "sp", [32, 15]], ["tile_ry", "sp", [1, 1]], ["tile_rx", "sp", [1, 1]], ["auto_unroll_max_step", "ot", 0], ["unroll_explicit", "ot", 1]], "t": "direct", "c": null}], "r": [[0.00013743925], 0, 1.9187650680541992, 1548657065.7516673], "v": 0.1}
{"i": ["cuda", "topi_nn_depthwise_conv2d_nchw", [["TENSOR", [1, 480, 7, 7], "float32"], ["TENSOR", [480, 1, 3, 3], "float32"], [1, 1], [1, 1], "float32"], {}, ["depthwise_conv2d_nchw", [1, 480, 7, 7, "float32"], [480, 1, 3, 3, "float32"], [1, 1], [1, 1], "float32"], {"i": 23621, "e": [["tile_f", "sp", [80, 2, 1, 3]], ["tile_y", "sp", [1, 1, 7, 1]], ["tile_x", "sp", [1, 1, 7, 1]], ["auto_unroll_max_step", "ot", 256], ["unroll_explicit", "ot", 0]], "t": "direct", "c": null}], "r": [[3.796775e-05], 0, 2.5406243801116943, 1548658554.4247355], "v": 0.1}
{"i": ["cuda", "topi_nn_conv2d", [["TENSOR", [1, 328, 7, 7], "float32"], ["TENSOR", [480, 328, 1, 1], "float32"], [1, 1], [0, 0], "NCHW", "float32"], {}, ["conv2d", [1, 328, 7, 7, "float32"], [480, 328, 1, 1, "float32"], [1, 1], [0, 0], "NCHW", "float32"], {"i": 51212, "e": [["tile_f", "sp", [8, 3, 20, 1]], ["tile_y", "sp", [1, 7, 1, 1]], ["tile_x", "sp", [1, 1, 7, 1]], ["tile_rc", "sp", [41, 8]], ["tile_ry", "sp", [1, 1]], ["tile_rx", "sp", [1, 1]], ["auto_unroll_max_step", "ot", 0], ["unroll_explicit", "ot", 0]], "t": "direct", "c": null}], "r": [[0.000105911], 0, 1.2114758491516113, 1548659160.2813828], "v": 0.1}
{"i": ["cuda", "topi_nn_depthwise_conv2d_nchw", [["TENSOR", [1, 328, 14, 14], "float32"], ["TENSOR", [328, 1, 3, 3], "float32"], [2, 2], [1, 1], "float32"], {}, ["depthwise_conv2d_nchw", [1, 328, 14, 14, "float32"], [328, 1, 3, 3, "float32"], [2, 2], [1, 1], "float32"], {"i": 7218, "e": [["tile_f", "sp", [41, 1, 8, 1]], ["tile_y", "sp", [1, 1, 7, 1]], ["tile_x", "sp", [1, 1, 7, 1]], ["auto_unroll_max_step", "ot", 1500], ["unroll_explicit", "ot", 1]], "t": "direct", "c": null}], "r": [[3.831175e-05], 0, 1.9223744869232178, 1548659793.643159], "v": 0.1}
{"i": ["cuda", "topi_nn_conv2d", [["TENSOR", [1, 296, 14, 14], "float32"], ["TENSOR", [328, 296, 1, 1], "float32"], [1, 1], [0, 0], "NCHW", "float32"], {}, ["conv2d", [1, 296, 14, 14, "float32"], [328, 296, 1, 1, "float32"], [1, 1], [0, 0], "NCHW", "float32"], {"i": 69322, "e": [["tile_f", "sp", [4, 1, 41, 2]], ["tile_y", "sp", [2, 7, 1, 1]], ["tile_x", "sp", [2, 1, 7, 1]], ["tile_rc", "sp", [37, 8]], ["tile_ry", "sp", [1, 1]], ["tile_rx", "sp", [1, 1]], ["auto_unroll_max_step", "ot", 0], ["unroll_explicit", "ot", 0]], "t": "direct", "c": null}], "r": [[0.000235302], 0, 2.302255630493164, 1548660675.0394955], "v": 0.1}
{"i": ["cuda", "topi_nn_depthwise_conv2d_nchw", [["TENSOR", [1, 296, 14, 14], "float32"], ["TENSOR", [296, 1, 3, 3], "float32"], [1, 1], [1, 1], "float32"], {}, ["depthwise_conv2d_nchw", [1, 296, 14, 14, "float32"], [296, 1, 3, 3, "float32"], [1, 1], [1, 1], "float32"], {"i": 112248, "e": [["tile_f", "sp", [148, 1, 2, 1]], ["tile_y", "sp", [1, 1, 7, 2]], ["tile_x", "sp", [1, 2, 7, 1]], ["auto_unroll_max_step", "ot", 1500], ["unroll_explicit", "ot", 1]], "t": "direct", "c": null}], "r": [[3.78955e-05], 0, 1.5320491790771484, 1548661622.8226697], "v": 0.1}
{"i": ["cuda", "topi_nn_conv2d", [["TENSOR", [1, 288, 14, 14], "float32"], ["TENSOR", [296, 288, 1, 1], "float32"], [1, 1], [0, 0], "NCHW", "float32"], {}, ["conv2d", [1, 288, 14, 14, "float32"], [296, 288, 1, 1, "float32"], [1, 1], [0, 0], "NCHW", "float32"], {"i": 130741, "e": [["tile_f", "sp", [4, 2, 37, 1]], ["tile_y", "sp", [2, 7, 1, 1]], ["tile_x", "sp", [2, 1, 7, 1]], ["tile_rc", "sp", [32, 9]], ["tile_ry", "sp", [1, 1]], ["tile_rx", "sp", [1, 1]], ["auto_unroll_max_step", "ot", 0], ["unroll_explicit", "ot", 0]], "t": "direct", "c": null}], "r": [[0.00021435875], 0, 1.6423635482788086, 1548662485.159752], "v": 0.1}
{"i": ["cuda", "topi_nn_depthwise_conv2d_nchw", [["TENSOR", [1, 288, 14, 14], "float32"], ["TENSOR", [288, 1, 3, 3], "float32"], [1, 1], [1, 1], "float32"], {}, ["depthwise_conv2d_nchw", [1, 288, 14, 14, "float32"], [288, 1, 3, 3, "float32"], [1, 1], [1, 1], "float32"], {"i": 676499, "e": [["tile_f", "sp", [72, 2, 2, 1]], ["tile_y", "sp", [1, 1, 14, 1]], ["tile_x", "sp", [1, 1, 7, 2]], ["auto_unroll_max_step", "ot", 256], ["unroll_explicit", "ot", 1]], "t": "direct", "c": null}], "r": [[3.786375e-05], 0, 1.390625238418579, 1548663463.9980013], "v": 0.1}
{"i": ["cuda", "topi_nn_conv2d", [["TENSOR", [1, 272, 14, 14], "float32"], ["TENSOR", [288, 272, 1, 1], "float32"], [1, 1], [0, 0], "NCHW", "float32"], {}, ["conv2d", [1, 272, 14, 14, "float32"], [288, 272, 1, 1, "float32"], [1, 1], [0, 0], "NCHW", "float32"], {"i": 4805431, "e": [["tile_f", "sp", [6, 6, 8, 1]], ["tile_y", "sp", [1, 7, 2, 1]], ["tile_x", "sp", [1, 1, 14, 1]], ["tile_rc", "sp", [34, 8]], ["tile_ry", "sp", [1, 1]], ["tile_rx", "sp", [1, 1]], ["auto_unroll_max_step", "ot", 0], ["unroll_explicit", "ot", 1]], "t": "direct", "c": null}], "r": [[0.00011731875], 0, 2.9426913261413574, 1548664977.3522089], "v": 0.1}
{"i": ["cuda", "topi_nn_depthwise_conv2d_nchw", [["TENSOR", [1, 272, 14, 14], "float32"], ["TENSOR", [272, 1, 3, 3], "float32"], [1, 1], [1, 1], "float32"], {}, ["depthwise_conv2d_nchw", [1, 272, 14, 14, "float32"], [272, 1, 3, 3, "float32"], [1, 1], [1, 1], "float32"], {"i": 160044, "e": [["tile_f", "sp", [34, 1, 8, 1]], ["tile_y", "sp", [1, 2, 7, 1]], ["tile_x", "sp", [1, 2, 7, 1]], ["auto_unroll_max_step", "ot", 256], ["unroll_explicit", "ot", 1]], "t": "direct", "c": null}], "r": [[3.8048e-05], 0, 1.3805427551269531, 1548666124.2337215], "v": 0.1}
{"i": ["cuda", "topi_nn_conv2d", [["TENSOR", [1, 376, 14, 14], "float32"], ["TENSOR", [272, 376, 1, 1], "float32"], [1, 1], [0, 0], "NCHW", "float32"], {}, ["conv2d", [1, 376, 14, 14, "float32"], [272, 376, 1, 1, "float32"], [1, 1], [0, 0], "NCHW", "float32"], {"i": 986321, "e": [["tile_f", "sp", [4, 17, 4, 1]], ["tile_y", "sp", [1, 7, 2, 1]], ["tile_x", "sp", [1, 1, 14, 1]], ["tile_rc", "sp", [47, 8]], ["tile_ry", "sp", [1, 1]], ["tile_rx", "sp", [1, 1]], ["auto_unroll_max_step", "ot", 0], ["unroll_explicit", "ot", 1]], "t": "direct", "c": null}], "r": [[0.00017648625], 0, 2.901970386505127, 1548666802.045066], "v": 0.1}
{"i": ["cuda", "topi_nn_depthwise_conv2d_nchw", [["TENSOR", [1, 376, 14, 14], "float32"], ["TENSOR", [376, 1, 3, 3], "float32"], [1, 1], [1, 1], "float32"], {}, ["depthwise_conv2d_nchw", [1, 376, 14, 14, "float32"], [376, 1, 3, 3, "float32"], [1, 1], [1, 1], "float32"], {"i": 31608, "e": [["tile_f", "sp", [188, 1, 2, 1]], ["tile_y", "sp", [1, 1, 7, 2]], ["tile_x", "sp", [1, 1, 14, 1]], ["auto_unroll_max_step", "ot", 256], ["unroll_explicit", "ot", 0]], "t": "direct", "c": null}], "r": [[5.722375e-05], 0, 1.8894000053405762, 1548667848.8311331], "v": 0.1}
{"i": ["cuda", "topi_nn_conv2d", [["TENSOR", [1, 408, 14, 14], "float32"], ["TENSOR", [376, 408, 1, 1], "float32"], [1, 1], [0, 0], "NCHW", "float32"], {}, ["conv2d", [1, 408, 14, 14, "float32"], [376, 408, 1, 1, "float32"], [1, 1], [0, 0], "NCHW", "float32"], {"i": 1399221, "e": [["tile_f", "sp", [4, 2, 47, 1]], ["tile_y", "sp", [2, 7, 1, 1]], ["tile_x", "sp", [1, 7, 2, 1]], ["tile_rc", "sp", [68, 6]], ["tile_ry", "sp", [1, 1]], ["tile_rx", "sp", [1, 1]], ["auto_unroll_max_step", "ot", 512], ["unroll_explicit", "ot", 1]], "t": "direct", "c": null}], "r": [[0.000361302], 0, 1.5910117626190186, 1548668723.9305615], "v": 0.1}
{"i": ["cuda", "topi_nn_depthwise_conv2d_nchw", [["TENSOR", [1, 408, 14, 14], "float32"], ["TENSOR", [408, 1, 3, 3], "float32"], [1, 1], [1, 1], "float32"], {}, ["depthwise_conv2d_nchw", [1, 408, 14, 14, "float32"], [408, 1, 3, 3, "float32"], [1, 1], [1, 1], "float32"], {"i": 371374, "e": [["tile_f", "sp", [102, 1, 1, 4]], ["tile_y", "sp", [1, 1, 14, 1]], ["tile_x", "sp", [1, 1, 14, 1]], ["auto_unroll_max_step", "ot", 256], ["unroll_explicit", "ot", 1]], "t": "direct", "c": null}], "r": [[5.76475e-05], 0, 2.138455390930176, 1548669478.0002713], "v": 0.1}
{"i": ["cuda", "topi_nn_conv2d", [["TENSOR", [1, 256, 14, 14], "float32"], ["TENSOR", [408, 256, 1, 1], "float32"], [1, 1], [0, 0], "NCHW", "float32"], {}, ["conv2d", [1, 256, 14, 14, "float32"], [408, 256, 1, 1, "float32"], [1, 1], [0, 0], "NCHW", "float32"], {"i": 3237695, "e": [["tile_f", "sp", [6, 1, 4, 17]], ["tile_y", "sp", [1, 7, 2, 1]], ["tile_x", "sp", [1, 1, 14, 1]], ["tile_rc", "sp", [32, 8]], ["tile_ry", "sp", [1, 1]], ["tile_rx", "sp", [1, 1]], ["auto_unroll_max_step", "ot", 512], ["unroll_explicit", "ot", 1]], "t": "direct", "c": null}], "r": [[0.00014766275], 0, 1.5402188301086426, 1548670679.6535883], "v": 0.1}
{"i": ["cuda", "topi_nn_depthwise_conv2d_nchw", [["TENSOR", [1, 256, 28, 28], "float32"], ["TENSOR", [256, 1, 3, 3], "float32"], [2, 2], [1, 1], "float32"], {}, ["depthwise_conv2d_nchw", [1, 256, 28, 28, "float32"], [256, 1, 3, 3, "float32"], [2, 2], [1, 1], "float32"], {"i": 233311, "e": [["tile_f", "sp", [128, 2, 1, 1]], ["tile_y", "sp", [2, 1, 7, 1]], ["tile_x", "sp", [1, 1, 14, 1]], ["auto_unroll_max_step", "ot", 1500], ["unroll_explicit", "ot", 1]], "t": "direct", "c": null}], "r": [[7.772775e-05], 0, 2.0413858890533447, 1548671505.4201894], "v": 0.1}
{"i": ["cuda", "topi_nn_conv2d", [["TENSOR", [1, 144, 28, 28], "float32"], ["TENSOR", [256, 144, 1, 1], "float32"], [1, 1], [0, 0], "NCHW", "float32"], {}, ["conv2d", [1, 144, 28, 28, "float32"], [256, 144, 1, 1, "float32"], [1, 1], [0, 0], "NCHW", "float32"], {"i": 1432721, "e": [["tile_f", "sp", [8, 4, 8, 1]], ["tile_y", "sp", [4, 7, 1, 1]], ["tile_x", "sp", [1, 1, 28, 1]], ["tile_rc", "sp", [18, 8]], ["tile_ry", "sp", [1, 1]], ["tile_rx", "sp", [1, 1]], ["auto_unroll_max_step", "ot", 0], ["unroll_explicit", "ot", 0]], "t": "direct", "c": null}], "r": [[0.000216294], 0, 1.6201062202453613, 1548672455.3859437], "v": 0.1}
{"i": ["cuda", "topi_nn_depthwise_conv2d_nchw", [["TENSOR", [1, 144, 28, 28], "float32"], ["TENSOR", [144, 1, 3, 3], "float32"], [1, 1], [1, 1], "float32"], {}, ["depthwise_conv2d_nchw", [1, 144, 28, 28, "float32"], [144, 1, 3, 3, "float32"], [1, 1], [1, 1], "float32"], {"i": 3046490, "e": [["tile_f", "sp", [72, 1, 1, 2]], ["tile_y", "sp", [2, 1, 7, 2]], ["tile_x", "sp", [1, 1, 28, 1]], ["auto_unroll_max_step", "ot", 1500], ["unroll_explicit", "ot", 1]], "t": "direct", "c": null}], "r": [[5.779175e-05], 0, 2.2191083431243896, 1548673391.4412506], "v": 0.1}
{"i": ["cuda", "topi_nn_conv2d", [["TENSOR", [1, 120, 28, 28], "float32"], ["TENSOR", [144, 120, 1, 1], "float32"], [1, 1], [0, 0], "NCHW", "float32"], {}, ["conv2d", [1, 120, 28, 28, "float32"], [144, 120, 1, 1, "float32"], [1, 1], [0, 0], "NCHW", "float32"], {"i": 3047741, "e": [["tile_f", "sp", [2, 1, 8, 9]], ["tile_y", "sp", [7, 1, 1, 4]], ["tile_x", "sp", [1, 1, 28, 1]], ["tile_rc", "sp", [20, 6]], ["tile_ry", "sp", [1, 1]], ["tile_rx", "sp", [1, 1]], ["auto_unroll_max_step", "ot", 0], ["unroll_explicit", "ot", 0]], "t": "direct", "c": null}], "r": [[0.0001163435], 0, 1.2421369552612305, 1548675456.083652], "v": 0.1}
{"i": ["cuda", "topi_nn_depthwise_conv2d_nchw", [["TENSOR", [1, 120, 56, 56], "float32"], ["TENSOR", [120, 1, 3, 3], "float32"], [2, 2], [1, 1], "float32"], {}, ["depthwise_conv2d_nchw", [1, 120, 56, 56, "float32"], [120, 1, 3, 3, "float32"], [2, 2], [1, 1], "float32"], {"i": 2269760, "e": [["tile_f", "sp", [120, 1, 1, 1]], ["tile_y", "sp", [2, 2, 7, 1]], ["tile_x", "sp", [1, 1, 28, 1]], ["auto_unroll_max_step", "ot", 256], ["unroll_explicit", "ot", 1]], "t": "direct", "c": null}], "r": [[0.00011662325], 0, 1.597099781036377, 1548676329.4550035], "v": 0.1}
{"i": ["cuda", "topi_nn_conv2d", [["TENSOR", [1, 88, 56, 56], "float32"], ["TENSOR", [120, 88, 1, 1], "float32"], [1, 1], [0, 0], "NCHW", "float32"], {}, ["conv2d", [1, 88, 56, 56, "float32"], [120, 88, 1, 1, "float32"], [1, 1], [0, 0], "NCHW", "float32"], {"i": 53975012, "e": [["tile_f", "sp", [2, 1, 4, 15]], ["tile_y", "sp", [14, 2, 1, 2]], ["tile_x", "sp", [1, 2, 28, 1]], ["tile_rc", "sp", [22, 4]], ["tile_ry", "sp", [1, 1]], ["tile_rx", "sp", [1, 1]], ["auto_unroll_max_step", "ot", 0], ["unroll_explicit", "ot", 1]], "t": "direct", "c": null}], "r": [[0.00027512525], 0, 1.369657278060913, 1548677300.418834], "v": 0.1}
{"i": ["cuda", "topi_nn_depthwise_conv2d_nchw", [["TENSOR", [1, 88, 56, 56], "float32"], ["TENSOR", [88, 1, 3, 3], "float32"], [1, 1], [1, 1], "float32"], {}, ["depthwise_conv2d_nchw", [1, 88, 56, 56, "float32"], [88, 1, 3, 3, "float32"], [1, 1], [1, 1], "float32"], {"i": 2750720, "e": [["tile_f", "sp", [88, 1, 1, 1]], ["tile_y", "sp", [2, 1, 4, 7]], ["tile_x", "sp", [1, 1, 56, 1]], ["auto_unroll_max_step", "ot", 1500], ["unroll_explicit", "ot", 1]], "t": "direct", "c": null}], "r": [[9.8191e-05], 0, 1.5733342170715332, 1548678185.3843915], "v": 0.1}
{"i": ["cuda", "topi_nn_conv2d", [["TENSOR", [1, 56, 56, 56], "float32"], ["TENSOR", [88, 56, 1, 1], "float32"], [1, 1], [0, 0], "NCHW", "float32"], {}, ["conv2d", [1, 56, 56, 56, "float32"], [88, 56, 1, 1, "float32"], [1, 1], [0, 0], "NCHW", "float32"], {"i": 13501456, "e": [["tile_f", "sp", [2, 11, 4, 1]], ["tile_y", "sp", [14, 1, 1, 4]], ["tile_x", "sp", [1, 1, 56, 1]], ["tile_rc", "sp", [14, 4]], ["tile_ry", "sp", [1, 1]], ["tile_rx", "sp", [1, 1]], ["auto_unroll_max_step", "ot", 0], ["unroll_explicit", "ot", 1]], "t": "direct", "c": null}], "r": [[0.0001444785], 0, 1.7148137092590332, 1548679401.0876276], "v": 0.1}
{"i": ["cuda", "topi_nn_depthwise_conv2d_nchw", [["TENSOR", [1, 56, 112, 112], "float32"], ["TENSOR", [56, 1, 3, 3], "float32"], [2, 2], [1, 1], "float32"], {}, ["depthwise_conv2d_nchw", [1, 56, 112, 112, "float32"], [56, 1, 3, 3, "float32"], [2, 2], [1, 1], "float32"], {"i": 2748800, "e": [["tile_f", "sp", [56, 1, 1, 1]], ["tile_y", "sp", [7, 1, 4, 2]], ["tile_x", "sp", [1, 1, 56, 1]], ["auto_unroll_max_step", "ot", 1500], ["unroll_explicit", "ot", 1]], "t": "direct", "c": null}], "r": [[0.0001829665], 0, 1.6487436294555664, 1548680224.10838], "v": 0.1}
{"i": ["cuda", "topi_nn_conv2d", [["TENSOR", [1, 16, 112, 112], "float32"], ["TENSOR", [56, 16, 1, 1], "float32"], [1, 1], [0, 0], "NCHW", "float32"], {}, ["conv2d", [1, 16, 112, 112, "float32"], [56, 16, 1, 1, "float32"], [1, 1], [0, 0], "NCHW", "float32"], {"i": 28698016, "e": [["tile_f", "sp", [2, 7, 4, 1]], ["tile_y", "sp", [56, 1, 1, 2]], ["tile_x", "sp", [2, 1, 56, 1]], ["tile_rc", "sp", [2, 8]], ["tile_ry", "sp", [1, 1]], ["tile_rx", "sp", [1, 1]], ["auto_unroll_max_step", "ot", 0], ["unroll_explicit", "ot", 1]], "t": "direct", "c": null}], "r": [[0.000139111], 0, 1.4088413715362549, 1548681204.6446605], "v": 0.1}
{"i": ["cuda", "topi_nn_depthwise_conv2d_nchw", [["TENSOR", [1, 16, 112, 112], "float32"], ["TENSOR", [16, 1, 3, 3], "float32"], [1, 1], [1, 1], "float32"], {}, ["depthwise_conv2d_nchw", [1, 16, 112, 112, "float32"], [16, 1, 3, 3, "float32"], [1, 1], [1, 1], "float32"], {"i": 3638775, "e": [["tile_f", "sp", [16, 1, 1, 1]], ["tile_y", "sp", [7, 1, 4, 4]], ["tile_x", "sp", [2, 1, 56, 1]], ["auto_unroll_max_step", "ot", 1500], ["unroll_explicit", "ot", 1]], "t": "direct", "c": null}], "r": [[7.75195e-05], 0, 1.5174787044525146, 1548682004.0559516], "v": 0.1}
{"i": ["cuda", "topi_nn_conv2d", [["TENSOR", [1, 3, 224, 224], "float32"], ["TENSOR", [16, 3, 3, 3], "float32"], [2, 2], [1, 1], "NCHW", "float32"], {}, ["conv2d", [1, 3, 224, 224, "float32"], [16, 3, 3, 3, "float32"], [2, 2], [1, 1], "NCHW", "float32"], {"i": 20787688, "e": [["tile_f", "sp", [1, 1, 2, 8]], ["tile_y", "sp", [28, 1, 2, 2]], ["tile_x", "sp", [2, 1, 56, 1]], ["tile_rc", "sp", [3, 1]], ["tile_ry", "sp", [1, 3]], ["tile_rx", "sp", [1, 3]], ["auto_unroll_max_step", "ot", 0], ["unroll_explicit", "ot", 1]], "t": "direct", "c": null}], "r": [[0.00013608675], 0, 3.140852451324463, 1548683091.1406922], "v": 0.1}
